[
  {
    "id": "schlaf-kleinkind-001",
    "thema": "schlaf",
    "phasen": [
      "P0",
      "P1"
    ],
    "aussage": "Babys ab 4 Monaten brauchen täglich etwa 12 bis 16 Stunden Schlaf. Ein- bis Zweijährige brauchen etwa 11 bis 14 Stunden.",
    "erklaerung": "Diese Spannen nennen die WHO-Leitlinie (2019) und der Konsens der US-Schlafmedizin (AASM, 2016) übereinstimmend. Beide Angaben schließen den Tagschlaf ein. Für Babys unter 4 Monaten gibt die AASM keine Empfehlung, weil das Normale stark schwankt. Die WHO nennt 14 bis 17 Stunden. Das BIÖG nennt als Durchschnitt etwa 14 Stunden mit einem Jahr und 12 bis 13 Stunden mit zwei Jahren. Einzelne Kinder weichen deutlich davon ab, ohne krank zu sein.",
    "wirkung": "einordnung",
    "ampel": "stark",
    "studientyp": "Leitlinie",
    "quellen": [
      {
        "titel": "To grow up healthy, children need to sit less and play more (Guidelines on physical activity, sedentary behaviour and sleep for children under 5 years of age)",
        "autoren": "World Health Organization",
        "jahr": 2019,
        "doi_oder_url": "https://www.who.int/news/item/24-04-2019-to-grow-up-healthy-children-need-to-sit-less-and-play-more",
        "typ": "Leitlinie",
        "geoeffnet_am": "2026-10-18"
      },
      {
        "titel": "Recommended Amount of Sleep for Pediatric Populations: A Consensus Statement of the American Academy of Sleep Medicine",
        "autoren": "Paruthi et al.",
        "jahr": 2016,
        "doi_oder_url": "10.5664/jcsm.5866",
        "typ": "Expertenkonsens",
        "geoeffnet_am": "2026-10-18"
      },
      {
        "titel": "Schlafbedarf und Schlafdauer (1–6 Jahre)",
        "autoren": "Bundesinstitut für Öffentliche Gesundheit (BIÖG), kindergesundheit-info.de",
        "jahr": 2025,
        "doi_oder_url": "https://www.kindergesundheit-info.de/themen/schlafen/1-6-jahre/schlafbedarf/",
        "typ": "Leitlinie",
        "geoeffnet_am": "2026-10-18"
      }
    ],
    "empfehlung_offiziell": {
      "stelle": "WHO",
      "jahr": 2019,
      "inhalt": "0–3 Monate 14–17 Std., 4–11 Monate 12–16 Std., 1–2 Jahre 11–14 Std. guter Schlaf inklusive Tagschlaf, mit regelmäßigen Schlaf- und Aufwachzeiten.",
      "url": "https://www.who.int/news/item/24-04-2019-to-grow-up-healthy-children-need-to-sit-less-and-play-more"
    },
    "tipps": {
      "eltern": [
        "Achten Sie auf Müdigkeitszeichen Ihres Kindes statt auf die Uhr.",
        "Regelmäßige Zeiten für Schlafen und Aufwachen helfen dem Rhythmus."
      ]
    },
    "wann_hilfe": "Schläft Ihr Kind dauerhaft viel weniger oder viel mehr als üblich? Ist es tagsüber auffällig erschöpft? Dann sprechen Sie mit der Kinderarztpraxis.",
    "stand": "2026-10-18",
    "status": "recherchiert"
  },
  {
    "id": "schlaf-kleinkind-002",
    "thema": "schlaf",
    "phasen": [
      "P0"
    ],
    "aussage": "Rückenlage, ein Schlafsack, ein eigenes Bett im Elternschlafzimmer und eine rauchfreie Umgebung senken das Risiko für den Plötzlichen Kindstod.",
    "erklaerung": "Die deutsche S1-Leitlinie (DGSM, 2022) und das BIÖG empfehlen außerdem eine feste Matratze ohne Kissen, Nestchen und Kuscheltiere. Dazu kommen: nicht pucken, nicht überwärmen (etwa 18 °C) und einen Schnuller anbieten. Die AAP (2022) empfiehlt dasselbe Prinzip: gemeinsames Zimmer, aber kein gemeinsames Bett. In Deutschland sank die Zahl der Fälle von 1.285 (1991) auf 84 (2020); 2024 starben noch 75 Kinder. Der Rückgang wird vor allem der Aufklärung zugeschrieben.",
    "wirkung": "hilft",
    "ampel": "stark",
    "studientyp": "Leitlinie",
    "quellen": [
      {
        "titel": "Wirksame Vorbeugung ist möglich – Empfehlungen zum Plötzlichen Kindstod (mit Bezug auf die S1-Leitlinie 063-002 der DGSM, 2022)",
        "autoren": "Bundesinstitut für Öffentliche Gesundheit (BIÖG), kindergesundheit-info.de",
        "jahr": 2024,
        "doi_oder_url": "https://www.kindergesundheit-info.de/themen/risiken-vorbeugen/ploetzlicher-kindstod-sids/vorbeugung-kindstod/",
        "typ": "Leitlinie",
        "geoeffnet_am": "2026-10-18"
      },
      {
        "titel": "Sleep-Related Infant Deaths: Updated 2022 Recommendations for Reducing Infant Deaths in the Sleep Environment",
        "autoren": "Moon, Carlin, Hand; AAP Task Force on SIDS",
        "jahr": 2022,
        "doi_oder_url": "10.1542/peds.2022-057990",
        "typ": "Leitlinie",
        "kernzitat": "room sharing without bed sharing",
        "geoeffnet_am": "2026-10-18"
      },
      {
        "titel": "Plötzlicher Kindstod in 30 Jahren um 93 Prozent zurückgegangen",
        "autoren": "Deutsches Ärzteblatt (Meldung zur Stiftung Kindergesundheit)",
        "jahr": 2022,
        "doi_oder_url": "https://www.aerzteblatt.de/nachrichten/139643/Ploetzlicher-Kindstod-in-30-Jahren-um-93-Prozent-zurueckgegangen",
        "typ": "Statistik",
        "geoeffnet_am": "2026-10-18"
      },
      {
        "titel": "Plötzlicher Kindstod (SIDS) – Übersicht",
        "autoren": "Bundesinstitut für Öffentliche Gesundheit (BIÖG), kindergesundheit-info.de",
        "jahr": 2026,
        "doi_oder_url": "https://www.kindergesundheit-info.de/themen/risiken-vorbeugen/ploetzlicher-kindstod-sids/",
        "typ": "Statistik",
        "geoeffnet_am": "2026-10-18"
      }
    ],
    "empfehlung_offiziell": {
      "stelle": "DGSM u. a. (AWMF-S1-Leitlinie 063-002), vermittelt durch BIÖG",
      "jahr": 2022,
      "inhalt": "Rückenlage, Schlafsack, eigenes Bett im Elternschlafzimmer im ersten Lebensjahr, rauchfreie Umgebung, Stillen, Schnuller anbieten, Überwärmung vermeiden.",
      "url": "https://www.kindergesundheit-info.de/themen/risiken-vorbeugen/ploetzlicher-kindstod-sids/vorbeugung-kindstod/"
    },
    "tipps": {
      "eltern": [
        "Legen Sie Ihr Baby zum Schlafen immer auf den Rücken.",
        "Nutzen Sie einen passenden Schlafsack statt Decke und Kissen.",
        "Babyphone und Atemmonitore senken das Risiko laut BIÖG nicht."
      ]
    },
    "wann_hilfe": "Bei Fragen zum sicheren Schlaf hilft die Kinderarztpraxis oder die Hebamme. Bei Atemaussetzern oder Blauverfärbung rufen Sie sofort den Notruf 112.",
    "stand": "2026-10-18",
    "status": "recherchiert"
  },
  {
    "id": "schlaf-kleinkind-003",
    "thema": "schlaf",
    "phasen": [
      "P0"
    ],
    "aussage": "Schlafen im Elternbett erhöht das Kindstod-Risiko vor allem bei Rauchen, Alkohol, Drogen und jungen Babys. Sonst ist das Ausmaß umstritten.",
    "erklaerung": "Eine Meta-Analyse aus 11 Studien fand ein etwa 2,9-fach erhöhtes Risiko. Bei rauchenden Müttern war es rund 6-fach, unter 12 Wochen rund 10-fach erhöht. Eine Auswertung von fünf großen Fall-Kontroll-Studien fand auch ohne Rauchen und Alkohol ein erhöhtes Risiko unter 3 Monaten. Das absolute Risiko blieb dabei klein: etwa 0,23 statt 0,08 Fälle pro 1.000 Geburten. Deutsche Empfehlung (BIÖG, DGSM-Leitlinie) und AAP raten vom gemeinsamen Bett ab.",
    "wirkung": "schadet",
    "ampel": "umstritten",
    "studientyp": "Meta-Analyse",
    "quellen": [
      {
        "titel": "Bed sharing and the risk of sudden infant death syndrome: can we resolve the debate?",
        "autoren": "Vennemann et al.",
        "jahr": 2012,
        "doi_oder_url": "10.1016/j.jpeds.2011.06.052",
        "typ": "Meta-Analyse",
        "kernzitat": "Bed sharing is a risk factor for SIDS",
        "geoeffnet_am": "2026-10-18"
      },
      {
        "titel": "Bed sharing when parents do not smoke: is there a risk of SIDS? An individual level analysis of five major case-control studies",
        "autoren": "Carpenter et al.",
        "jahr": 2013,
        "doi_oder_url": "10.1136/bmjopen-2012-002299",
        "typ": "Meta-Analyse",
        "kernzitat": "Smoking and alcohol use greatly increased bed sharing risk.",
        "geoeffnet_am": "2026-10-18"
      },
      {
        "titel": "Bed-sharing in the absence of hazardous circumstances: is there a risk of sudden infant death syndrome?",
        "autoren": "Blair, Sidebotham, Pease, Fleming",
        "jahr": 2014,
        "doi_oder_url": "10.1371/journal.pone.0107799",
        "typ": "Einzelstudie",
        "kernzitat": "Sofa-sharing is not a safe alternative to bed-sharing",
        "geoeffnet_am": "2026-10-18"
      },
      {
        "titel": "Wirksame Vorbeugung ist möglich – Empfehlungen zum Plötzlichen Kindstod (mit Bezug auf die S1-Leitlinie 063-002 der DGSM, 2022)",
        "autoren": "Bundesinstitut für Öffentliche Gesundheit (BIÖG), kindergesundheit-info.de",
        "jahr": 2024,
        "doi_oder_url": "https://www.kindergesundheit-info.de/themen/risiken-vorbeugen/ploetzlicher-kindstod-sids/vorbeugung-kindstod/",
        "typ": "Leitlinie",
        "geoeffnet_am": "2026-10-18"
      },
      {
        "titel": "Sleep-Related Infant Deaths: Updated 2022 Recommendations for Reducing Infant Deaths in the Sleep Environment",
        "autoren": "Moon, Carlin, Hand; AAP Task Force on SIDS",
        "jahr": 2022,
        "doi_oder_url": "10.1542/peds.2022-057990",
        "typ": "Leitlinie",
        "kernzitat": "room sharing without bed sharing",
        "geoeffnet_am": "2026-10-18"
      }
    ],
    "empfehlung_offiziell": {
      "stelle": "BIÖG / DGSM-Leitlinie; AAP",
      "jahr": 2022,
      "inhalt": "Eigenes Babybett im Elternschlafzimmer; vom Schlafen im Familienbett wird abgeraten.",
      "url": "https://www.kindergesundheit-info.de/themen/risiken-vorbeugen/ploetzlicher-kindstod-sids/vorbeugung-kindstod/"
    },
    "gegenstimmen": "Blair et al. (2014, zwei britische Fall-Kontroll-Studien) fanden ohne Gefahrenfaktoren kein signifikant erhöhtes Risiko. Sehr hoch war das Risiko auf dem Sofa und neben Erwachsenen, die Alkohol getrunken hatten. Sie empfehlen daher, gezielt vor diesen Situationen zu warnen statt pauschal. Carpenter et al. (2013) kommen zum gegenteiligen Schluss. Die Debatte dreht sich auch um die Kontrolle von Störfaktoren.",
    "tipps": {
      "eltern": [